{
  "schema_version": "0.1",
  "protocol_id": "SEMANTIC_SURFACE_SUCCESSOR_PROTOCOL_0_1",
  "oracle_id": "OR_1cd6639e80ee8a57cd3b7a6d8c53b9d5",
  "oracle_kind": "HARNESS_DUMMY_KEY",
  "stimulus_id": "ST_39f073f9c738fbb26f877e8254ac0c77",
  "stimulus_ref": {
    "ref_id": "RF_63eebe31c6a7bd3a6ee26201a54fe06b",
    "locator": "dummy_oracles/stimuli/st_39f073f9c738fbb26f877e8254ac0c77.json",
    "sha256": "8a16cf7fa18bf41fccfe40e22b3cc3995ca7362626088f6fbcf4101958658af9",
    "byte_length": 780,
    "media_type": "application/json",
    "immutability": "CONTENT_ADDRESS"
  },
  "axis_applicability": { "resolution": true, "decision": false, "recoverability": false, "plan_status": false },
  "allowed_outcome_tuples": [
    { "resolution": "RESOLVED", "decision": "NOT_APPLICABLE", "recoverability": "NOT_APPLICABLE", "plan_status": "NOT_REQUESTED" }
  ],
  "required_claims": [
    {
      "claim_id": "RQ_7cf36ad3adfbd93c6dc955c9056de6ad",
      "target_json_pointer": "/semantic_claims",
      "predicate": { "operator": "NONEMPTY", "expected_value": true },
      "evidence_standard": "NATIVE_POINTER",
      "allowed_mapping_origins": ["NATIVE", "MECHANICALLY_MAPPED"]
    }
  ],
  "forbidden_behaviors": [
    {
      "behavior_id": "FB_a79cd97213cf70e67995185256713e54",
      "rule_code": "CONSTANT_CONFLICT_POSTURE",
      "description": "A candidate-native CONFLICT does not match this deterministic dummy lookup."
    }
  ],
  "derivation_records": [
    {
      "derivation_id": "DR_72747608b5743f309881850682614d11",
      "basis_class": "EXPERIMENTAL_CONVENTION",
      "statement": "This vector checks that a mechanically faithful conflict remains visible and then fails semantic matching.",
      "evidence_refs": []
    }
  ],
  "scoreability_rule": {
    "scoreable_run_states": ["OBSERVED"],
    "non_scoreable_run_states": ["BLOCKED", "STOPPED", "CONTAMINATED", "INVALID", "INCOMPLETE", "BUDGET_EXHAUSTED"]
  },
  "dummy_fixture": {
    "profile": "ALWAYS_CONFLICT",
    "native_emission": {
      "media_type": "application/json", "content_encoding": "UTF-8",
      "content_base64": "eyJjb25mbGljdHMiOlt7ImlkIjoiY29uZl9hMSIsImNsYWltcyI6WyJwNCIsInA0X2FsdCJdfV0sIm91dGNvbWUiOnsicmVzb2x1dGlvbiI6IkNPTkZMSUNUIiwiZGVjaXNpb24iOiJOT1RfQVBQTElDQUJMRSIsInJlY292ZXJhYmlsaXR5IjoiTk9UX0FQUExJQ0FCTEUiLCJwbGFuX3N0YXR1cyI6Ik5PVF9SRVFVRVNURUQifX0=",
      "byte_length": 185,
      "actual_sha256": "30641e0352e6394bf3800f2a0d82d76f15de18a4a6e4b779043be5630b8de590",
      "capture_declared_sha256": "30641e0352e6394bf3800f2a0d82d76f15de18a4a6e4b779043be5630b8de590",
      "exit_code": 0
    },
    "adapter_projection": {
      "outcome": { "resolution": "CONFLICT", "decision": "NOT_APPLICABLE", "recoverability": "NOT_APPLICABLE", "plan_status": "NOT_REQUESTED" },
      "claim_ids": [], "conflict_ids": ["conf_a1"], "unknown_ids": [], "loss_ids": [],
      "native_digest_seen": "30641e0352e6394bf3800f2a0d82d76f15de18a4a6e4b779043be5630b8de590",
      "ref_tokens": {
        "spec": "TK_84f155c8eb305dfc02c109f2d7334c18", "harness": "TK_3370c5dcebd8140d214513103f9672f8",
        "candidate": "TK_34490be14352b8668fe377215a05a61a", "adapter": "TK_d7b07dc333dd615abc391edea8651a8e",
        "environment": "TK_e595bef23138c174edc1a0c39ee18913", "resource": "TK_5cf8d730eafafce607b36b695c7a263c",
        "stimulus": "TK_de68c9f010078f898e6bab418357d14a", "oracle": "TK_71aac4e56fcd81b3f5e3d68d9d4e0d8e"
      }
    },
    "forced_run_state": "OBSERVED",
    "expected_mechanical_disposition": "ACCEPT",
    "expected_semantic_disposition": "MISMATCH",
    "expected_scoreability": "SCOREABLE",
    "expected_reason_codes": ["OUTCOME_TUPLE_MISMATCH"]
  },
  "authority_boundary": { "validation_claim": "NONE", "selection_authority": "NONE", "promotion_authority": "NONE", "main_merge_authority": false, "production_authority": false }
}
