{
  "schema_version": "0.1", "protocol_id": "SEMANTIC_SURFACE_SUCCESSOR_PROTOCOL_0_1",
  "oracle_id": "OR_58c401d1c1da4457f9f0ebcb2df22269", "oracle_kind": "HARNESS_DUMMY_KEY",
  "stimulus_id": "ST_b94e44c450e911748891aea3385e5b77",
  "stimulus_ref": { "ref_id": "RF_dc4570d71a780d3858f3a0c8a9c5788e", "locator": "dummy_oracles/stimuli/st_b94e44c450e911748891aea3385e5b77.json", "sha256": "b86c47ad05e83cf9badb5aec7df91ed76c2d3a2b1a41ee313e99c9d0ae82e9ed", "byte_length": 780, "media_type": "application/json", "immutability": "CONTENT_ADDRESS" },
  "axis_applicability": { "resolution": true, "decision": false, "recoverability": false, "plan_status": false },
  "allowed_outcome_tuples": [{ "resolution": "RESOLVED", "decision": "NOT_APPLICABLE", "recoverability": "NOT_APPLICABLE", "plan_status": "NOT_REQUESTED" }],
  "required_claims": [{ "claim_id": "RQ_3686f821adcb75b901e7c7697971e242", "target_json_pointer": "/semantic_claims", "predicate": { "operator": "NONEMPTY", "expected_value": true }, "evidence_standard": "NATIVE_POINTER", "allowed_mapping_origins": ["NATIVE", "MECHANICALLY_MAPPED"] }],
  "forbidden_behaviors": [{ "behavior_id": "FB_96d9f7fe1ad1e2c3797712d0d3812c1e", "rule_code": "NATIVE_DIGEST_MISMATCH_ACCEPTED", "description": "The envelope cannot cite a digest different from captured native bytes." }],
  "derivation_records": [{ "derivation_id": "DR_b6cdd7ccb690fed1ac9383c5e9a1b8d3", "basis_class": "EXPERIMENTAL_CONVENTION", "statement": "This vector forces a native/capture digest mismatch.", "evidence_refs": [] }],
  "scoreability_rule": { "scoreable_run_states": ["OBSERVED"], "non_scoreable_run_states": ["BLOCKED", "STOPPED", "CONTAMINATED", "INVALID", "INCOMPLETE", "BUDGET_EXHAUSTED"] },
  "dummy_fixture": {
    "profile": "NATIVE_DIGEST_MISMATCH",
    "native_emission": { "media_type": "application/json", "content_encoding": "UTF-8", "content_base64": "eyJjbGFpbXMiOlt7ImlkIjoiY2xtX2E3IiwicGF0aCI6Ii9yZXN1bHQvdmFsdWUiLCJ2YWx1ZSI6Imo3In1dLCJvdXRjb21lIjp7InJlc29sdXRpb24iOiJSRVNPTFZFRCIsImRlY2lzaW9uIjoiTk9UX0FQUExJQ0FCTEUiLCJyZWNvdmVyYWJpbGl0eSI6Ik5PVF9BUFBMSUNBQkxFIiwicGxhbl9zdGF0dXMiOiJOT1RfUkVRVUVTVEVEIn0sInJlc3VsdCI6eyJ2YWx1ZSI6Imo3In19", "byte_length": 216, "actual_sha256": "bc76f6360a806e285f1e7aad883225646a3e677eabf8e335be25ddf36a5128c5", "capture_declared_sha256": "63e824aede7449db03afc522ea0d754d7b1243b7c84fe947c90cdb731bfc8fe4", "exit_code": 0 },
    "adapter_projection": { "outcome": { "resolution": "RESOLVED", "decision": "NOT_APPLICABLE", "recoverability": "NOT_APPLICABLE", "plan_status": "NOT_REQUESTED" }, "claim_ids": ["clm_a7"], "conflict_ids": [], "unknown_ids": [], "loss_ids": [], "native_digest_seen": "63e824aede7449db03afc522ea0d754d7b1243b7c84fe947c90cdb731bfc8fe4", "ref_tokens": { "spec": "TK_84f155c8eb305dfc02c109f2d7334c18", "harness": "TK_3370c5dcebd8140d214513103f9672f8", "candidate": "TK_34490be14352b8668fe377215a05a61a", "adapter": "TK_d7b07dc333dd615abc391edea8651a8e", "environment": "TK_e595bef23138c174edc1a0c39ee18913", "resource": "TK_5cf8d730eafafce607b36b695c7a263c", "stimulus": "TK_de68c9f010078f898e6bab418357d14a", "oracle": "TK_71aac4e56fcd81b3f5e3d68d9d4e0d8e" } },
    "forced_run_state": "INVALID", "expected_mechanical_disposition": "REJECT", "expected_semantic_disposition": "NOT_EVALUATED", "expected_scoreability": "NON_SCOREABLE", "expected_reason_codes": ["NATIVE_DIGEST_MISMATCH"]
  },
  "authority_boundary": { "validation_claim": "NONE", "selection_authority": "NONE", "promotion_authority": "NONE", "main_merge_authority": false, "production_authority": false }
}
