{
  "schema_version": "0.1",
  "protocol_id": "SEMANTIC_SURFACE_SUCCESSOR_PROTOCOL_0_1",
  "oracle_id": "OR_041436a5ca9eaab507e491134d2cc1b1",
  "oracle_kind": "HARNESS_DUMMY_KEY",
  "stimulus_id": "ST_21a844d38ac5b0b6b0e4b6c6e9e26be7",
  "stimulus_ref": {
    "ref_id": "RF_26e90a744bceb65c221318cd2b8d1c3c",
    "locator": "dummy_oracles/stimuli/st_21a844d38ac5b0b6b0e4b6c6e9e26be7.json",
    "sha256": "e4a91d245cda33057225ed46ff5105733ede23c3d02ea0503480a25d96a83f79",
    "byte_length": 780,
    "media_type": "application/json",
    "immutability": "CONTENT_ADDRESS"
  },
  "axis_applicability": { "resolution": true, "decision": false, "recoverability": false, "plan_status": false },
  "allowed_outcome_tuples": [
    { "resolution": "RESOLVED", "decision": "NOT_APPLICABLE", "recoverability": "NOT_APPLICABLE", "plan_status": "NOT_REQUESTED" }
  ],
  "required_claims": [
    {
      "claim_id": "RQ_b8723c64526657c919467042fe93ee6a",
      "target_json_pointer": "/semantic_claims",
      "predicate": { "operator": "NONEMPTY", "expected_value": true },
      "evidence_standard": "NATIVE_POINTER",
      "allowed_mapping_origins": ["NATIVE", "MECHANICALLY_MAPPED"]
    }
  ],
  "forbidden_behaviors": [
    {
      "behavior_id": "FB_bceee05cf022b62d6157df2785428106",
      "rule_code": "CONSTANT_REFUSAL_POSTURE",
      "description": "A candidate-native refusal does not match this deterministic dummy lookup."
    }
  ],
  "derivation_records": [
    {
      "derivation_id": "DR_4acca252041f9cd7cf1d3fe279008ad0",
      "basis_class": "EXPERIMENTAL_CONVENTION",
      "statement": "This vector checks that a mechanically faithful refusal remains visible and then fails semantic matching.",
      "evidence_refs": []
    }
  ],
  "scoreability_rule": {
    "scoreable_run_states": ["OBSERVED"],
    "non_scoreable_run_states": ["BLOCKED", "STOPPED", "CONTAMINATED", "INVALID", "INCOMPLETE", "BUDGET_EXHAUSTED"]
  },
  "dummy_fixture": {
    "profile": "ALWAYS_REFUSE",
    "native_emission": {
      "media_type": "application/json", "content_encoding": "UTF-8",
      "content_base64": "eyJhY3Rpb24iOnsicG9zdHVyZSI6IlJFRlVTRSIsInJlYXNvbiI6ImRlZmF1bHQifSwib3V0Y29tZSI6eyJyZXNvbHV0aW9uIjoiUkVTT0xWRUQiLCJkZWNpc2lvbiI6IlJFRlVTRSIsInJlY292ZXJhYmlsaXR5IjoiTk9UX0FQUExJQ0FCTEUiLCJwbGFuX3N0YXR1cyI6Ik5PVF9SRVFVRVNURUQifX0=",
      "byte_length": 170,
      "actual_sha256": "307c869e9000093b4caa41f951913c235a3ad89014ca34004c380cde183dc094",
      "capture_declared_sha256": "307c869e9000093b4caa41f951913c235a3ad89014ca34004c380cde183dc094",
      "exit_code": 0
    },
    "adapter_projection": {
      "outcome": { "resolution": "RESOLVED", "decision": "REFUSE", "recoverability": "NOT_APPLICABLE", "plan_status": "NOT_REQUESTED" },
      "claim_ids": [], "conflict_ids": [], "unknown_ids": [], "loss_ids": [],
      "native_digest_seen": "307c869e9000093b4caa41f951913c235a3ad89014ca34004c380cde183dc094",
      "ref_tokens": {
        "spec": "TK_84f155c8eb305dfc02c109f2d7334c18", "harness": "TK_3370c5dcebd8140d214513103f9672f8",
        "candidate": "TK_34490be14352b8668fe377215a05a61a", "adapter": "TK_d7b07dc333dd615abc391edea8651a8e",
        "environment": "TK_e595bef23138c174edc1a0c39ee18913", "resource": "TK_5cf8d730eafafce607b36b695c7a263c",
        "stimulus": "TK_de68c9f010078f898e6bab418357d14a", "oracle": "TK_71aac4e56fcd81b3f5e3d68d9d4e0d8e"
      }
    },
    "forced_run_state": "OBSERVED",
    "expected_mechanical_disposition": "ACCEPT",
    "expected_semantic_disposition": "MISMATCH",
    "expected_scoreability": "SCOREABLE",
    "expected_reason_codes": ["OUTCOME_TUPLE_MISMATCH"]
  },
  "authority_boundary": { "validation_claim": "NONE", "selection_authority": "NONE", "promotion_authority": "NONE", "main_merge_authority": false, "production_authority": false }
}
