{
  "schema_version": "0.1", "protocol_id": "SEMANTIC_SURFACE_SUCCESSOR_PROTOCOL_0_1",
  "oracle_id": "OR_725e9aee188f54af5176c00455d91c98", "oracle_kind": "HARNESS_DUMMY_KEY",
  "stimulus_id": "ST_9f172cabaa6b067a67c79003fb225122",
  "stimulus_ref": { "ref_id": "RF_ebcd3d5081414cd72db5409c7e35a2b6", "locator": "dummy_oracles/stimuli/st_9f172cabaa6b067a67c79003fb225122.json", "sha256": "f7e4b54631f3cda0440142c24c10e2f9c66cd8ee767e5002d0d75fc8b3dba728", "byte_length": 780, "media_type": "application/json", "immutability": "CONTENT_ADDRESS" },
  "axis_applicability": { "resolution": true, "decision": false, "recoverability": false, "plan_status": false },
  "allowed_outcome_tuples": [{ "resolution": "RESOLVED", "decision": "NOT_APPLICABLE", "recoverability": "NOT_APPLICABLE", "plan_status": "NOT_REQUESTED" }],
  "required_claims": [{ "claim_id": "RQ_4c6931e41f734a43e8895f00c5e74e79", "target_json_pointer": "/semantic_claims", "predicate": { "operator": "NONEMPTY", "expected_value": true }, "evidence_standard": "NATIVE_POINTER", "allowed_mapping_origins": ["NATIVE", "MECHANICALLY_MAPPED"] }],
  "forbidden_behaviors": [{ "behavior_id": "FB_0de521def83f5a74ce33c7812e343f8f", "rule_code": "REFERENCE_MISMATCH_ACCEPTED", "description": "Wrong candidate, adapter, spec, harness, input, oracle, environment, or resource refs are invalid." }],
  "derivation_records": [{ "derivation_id": "DR_77d2cc0147fe489f0623d851f7b48f7a", "basis_class": "EXPERIMENTAL_CONVENTION", "statement": "This vector changes only the emitted candidate ref token.", "evidence_refs": [] }],
  "scoreability_rule": { "scoreable_run_states": ["OBSERVED"], "non_scoreable_run_states": ["BLOCKED", "STOPPED", "CONTAMINATED", "INVALID", "INCOMPLETE", "BUDGET_EXHAUSTED"] },
  "dummy_fixture": {
    "profile": "WRONG_REFS",
    "native_emission": { "media_type": "application/json", "content_encoding": "UTF-8", "content_base64": "eyJjbGFpbXMiOlt7ImlkIjoiY2xtX2QwIiwicGF0aCI6Ii9yZXN1bHQvdmFsdWUiLCJ2YWx1ZSI6InExIn1dLCJvdXRjb21lIjp7InJlc29sdXRpb24iOiJSRVNPTFZFRCIsImRlY2lzaW9uIjoiTk9UX0FQUExJQ0FCTEUiLCJyZWNvdmVyYWJpbGl0eSI6Ik5PVF9BUFBMSUNBQkxFIiwicGxhbl9zdGF0dXMiOiJOT1RfUkVRVUVTVEVEIn0sInJlc3VsdCI6eyJ2YWx1ZSI6InExIn19", "byte_length": 216, "actual_sha256": "8efd5da7081b2190e60e1572c51164fbab1107e690ba2ee9009c5a859c694542", "capture_declared_sha256": "8efd5da7081b2190e60e1572c51164fbab1107e690ba2ee9009c5a859c694542", "exit_code": 0 },
    "adapter_projection": { "outcome": { "resolution": "RESOLVED", "decision": "NOT_APPLICABLE", "recoverability": "NOT_APPLICABLE", "plan_status": "NOT_REQUESTED" }, "claim_ids": ["clm_d0"], "conflict_ids": [], "unknown_ids": [], "loss_ids": [], "native_digest_seen": "8efd5da7081b2190e60e1572c51164fbab1107e690ba2ee9009c5a859c694542", "ref_tokens": { "spec": "TK_84f155c8eb305dfc02c109f2d7334c18", "harness": "TK_3370c5dcebd8140d214513103f9672f8", "candidate": "TK_f4f4be5b2e2bfa08f84e49c3904e462e", "adapter": "TK_d7b07dc333dd615abc391edea8651a8e", "environment": "TK_e595bef23138c174edc1a0c39ee18913", "resource": "TK_5cf8d730eafafce607b36b695c7a263c", "stimulus": "TK_de68c9f010078f898e6bab418357d14a", "oracle": "TK_71aac4e56fcd81b3f5e3d68d9d4e0d8e" } },
    "forced_run_state": "INVALID", "expected_mechanical_disposition": "REJECT", "expected_semantic_disposition": "NOT_EVALUATED", "expected_scoreability": "NON_SCOREABLE", "expected_reason_codes": ["REFERENCE_MISMATCH"]
  },
  "authority_boundary": { "validation_claim": "NONE", "selection_authority": "NONE", "promotion_authority": "NONE", "main_merge_authority": false, "production_authority": false }
}
