{
  "schema_version": "0.1",
  "protocol_id": "SEMANTIC_SURFACE_SUCCESSOR_PROTOCOL_0_1",
  "oracle_id": "OR_47b07bf4a00e085a5ec5ed7bc7079158",
  "oracle_kind": "HARNESS_DUMMY_KEY",
  "stimulus_id": "ST_1fed5c9bbce6d4beb27d0dbfd622c9f8",
  "stimulus_ref": {
    "ref_id": "RF_a0cf9b53a951258a748ce6dfa2fd411a",
    "locator": "dummy_oracles/stimuli/st_1fed5c9bbce6d4beb27d0dbfd622c9f8.json",
    "sha256": "819e891f247e78c7390b54108c1199bb639a1117f18942ba39f137cb456c9b91",
    "byte_length": 780,
    "media_type": "application/json",
    "immutability": "CONTENT_ADDRESS"
  },
  "axis_applicability": { "resolution": true, "decision": false, "recoverability": false, "plan_status": false },
  "allowed_outcome_tuples": [
    { "resolution": "RESOLVED", "decision": "NOT_APPLICABLE", "recoverability": "NOT_APPLICABLE", "plan_status": "NOT_REQUESTED" }
  ],
  "required_claims": [
    {
      "claim_id": "RQ_57a9029470138243261bf0002ad5528f",
      "target_json_pointer": "/semantic_claims",
      "predicate": { "operator": "NONEMPTY", "expected_value": true },
      "evidence_standard": "NATIVE_POINTER",
      "allowed_mapping_origins": ["NATIVE", "MECHANICALLY_MAPPED"]
    }
  ],
  "forbidden_behaviors": [
    {
      "behavior_id": "FB_5aff9d31ce24dc0c0722de478d5a18be",
      "rule_code": "CONSTANT_UNKNOWN_POSTURE",
      "description": "A candidate-native UNKNOWN does not match this deterministic dummy lookup."
    }
  ],
  "derivation_records": [
    {
      "derivation_id": "DR_d0bfdb96abcab2f887f1dc20a5327f42",
      "basis_class": "EXPERIMENTAL_CONVENTION",
      "statement": "This vector checks that a mechanically faithful UNKNOWN remains visible and then fails semantic matching.",
      "evidence_refs": []
    }
  ],
  "scoreability_rule": {
    "scoreable_run_states": ["OBSERVED"],
    "non_scoreable_run_states": ["BLOCKED", "STOPPED", "CONTAMINATED", "INVALID", "INCOMPLETE", "BUDGET_EXHAUSTED"]
  },
  "dummy_fixture": {
    "profile": "ALWAYS_UNKNOWN",
    "native_emission": {
      "media_type": "application/json",
      "content_encoding": "UTF-8",
      "content_base64": "eyJvdXRjb21lIjp7InJlc29sdXRpb24iOiJVTktOT1dOIiwiZGVjaXNpb24iOiJOT1RfQVBQTElDQUJMRSIsInJlY292ZXJhYmlsaXR5IjoiTk9UX0FQUExJQ0FCTEUiLCJwbGFuX3N0YXR1cyI6Ik5PVF9SRVFVRVNURUQifSwidW5rbm93bnMiOlt7ImlkIjoidW5rX2ExIiwicmVhc29uIjoibm9fYW5zd2VyIn1dfQ==",
      "byte_length": 178,
      "actual_sha256": "add51455d5948e752bc72ce26424198c86c8c4df63379afb99c33990d2e8f3f7",
      "capture_declared_sha256": "add51455d5948e752bc72ce26424198c86c8c4df63379afb99c33990d2e8f3f7",
      "exit_code": 0
    },
    "adapter_projection": {
      "outcome": { "resolution": "UNKNOWN", "decision": "NOT_APPLICABLE", "recoverability": "NOT_APPLICABLE", "plan_status": "NOT_REQUESTED" },
      "claim_ids": [],
      "conflict_ids": [],
      "unknown_ids": ["unk_a1"],
      "loss_ids": [],
      "native_digest_seen": "add51455d5948e752bc72ce26424198c86c8c4df63379afb99c33990d2e8f3f7",
      "ref_tokens": {
        "spec": "TK_84f155c8eb305dfc02c109f2d7334c18", "harness": "TK_3370c5dcebd8140d214513103f9672f8",
        "candidate": "TK_34490be14352b8668fe377215a05a61a", "adapter": "TK_d7b07dc333dd615abc391edea8651a8e",
        "environment": "TK_e595bef23138c174edc1a0c39ee18913", "resource": "TK_5cf8d730eafafce607b36b695c7a263c",
        "stimulus": "TK_de68c9f010078f898e6bab418357d14a", "oracle": "TK_71aac4e56fcd81b3f5e3d68d9d4e0d8e"
      }
    },
    "forced_run_state": "OBSERVED",
    "expected_mechanical_disposition": "ACCEPT",
    "expected_semantic_disposition": "MISMATCH",
    "expected_scoreability": "SCOREABLE",
    "expected_reason_codes": ["OUTCOME_TUPLE_MISMATCH"]
  },
  "authority_boundary": { "validation_claim": "NONE", "selection_authority": "NONE", "promotion_authority": "NONE", "main_merge_authority": false, "production_authority": false }
}
